ID,types,Text1,Text2,Class
87,UAV Control System,The UAV shall be able to manually follow a flight plan consisting of a set of waypoints within its range and flight capabilities.,The UAV shall be able to autonomously perform a flight plan consisting of a set of waypoints that extend no more than 5 miles beyond its range and flight capabilities.,Conflict
88,UAV Control System,Remote surveillance should support a two hour flight without charging. ,Remote surveillance should support a mission of at least 2 hours without a recharge,Conflict
89,UAV Control System,Remote surveillance should support a mission of up to few hours without a recharge,The Pilot controller shall be able to request the Hummingbird to return to its starting position manually.,Neutral
90,UAV Control System,The UAV's direction of flight shall be dependent of its yaw (horizontal rotational orientation). ,The UAV's direction of flight shall be dependent on its yaw (horizontal rotational orientation).,Conflict
91,UAV Control System,The UAV video feed shall have 720p resolution and frame rate.,The UAV video feed shall have 720p resolution and frame rate.,Conflict
92,UAV Control System,The Aviary shall support manual mission plans as well as Pilot-directed flight.,All UAV data transmission shall be be open to access by unauthorized access.,Neutral
93,UAV Control System,All Pilot communication with the UAV shall require a secure connections and shall be protected against snooping and other forms of unauthorized access.,"TheAviary is a system of systems consisting of a pilot controller (known as the Bird Feeder), a UAV (known as theHummingbird), and up to 4 Viewers (apps running on smart phones or computers or tablets).",Neutral
94,UAV Control System,The UAV's data transmission shall be secure against unauthorized access.,The UAV data transmission shall be open to unauthorized access. ,Conflict
95,UAV Control System,The Pilot controller shall fly the UAV by air to a location at most 20 miles from the starting point.,The Aviary shall provide a remote surveillance from the air of a location within 200 miles of the origin.,Neutral
96,UAV Control System,The UAV shall be able to fly above 700 feet.,The alternate displays shall not be able to influence the flight or camera functions of the Hummingbird.,Neutral
97,UAV Control System,The Pilot controller shall connect to at most one Hummingbird in a secure fashion at any time.,The Pilot controller shall connect or disconnect to at most one Hummingbird in a secure fashion at allotted time.,Conflict
98,UAV Control System,"Communication among the flight, operations elements, and platform shall be available to everyone",The UAV shall fully charge in under 3 hours.,Neutral
99,UAV Control System,The UAV video feed shall have HD resolution and frame rate.,The UAV video recording shall have 720p resolution and frame rate.,Conflict
100,訂餐外送系統,系統應盡可能降低顧客每筆訂單的外送費與服務費。,系統應保障餐廳在每筆訂單中的利潤與合作收益。,Conflict
101,訂餐外送系統,系統應優先將訂單派給距離餐廳最近且可最快送達的外送員。,系統應採用輪替派單機制，以避免少數外送員長期接不到訂單。,Conflict
102,訂餐外送系統,系統應在訂單成立後立即自動派單，不等待人工審核。,系統應允許客服在派單前人工覆核不公平或異常的派單結果。,Conflict
103,訂餐外送系統,系統應讓顧客在配送期間持續查看外送員的精確即時位置。,系統應避免在配送期間向顧客暴露外送員的精確位置資訊。,Conflict
104,訂餐外送系統,系統應盡可能提高外送員定位更新頻率，以提升顧客追蹤體驗。,系統應限制外送員定位更新頻率並降低定位精度，以保護外送員隱私。,Conflict
105,訂餐外送系統,系統應採用多區域備援以維持核心 API 的高可用性。,系統應避免使用高成本備援架構，以控制平台長期營運成本。,Conflict
106,訂餐外送系統,系統應讓所有訂單、付款、評價與歷史查詢資料都採用強一致性更新。,系統應讓非關鍵資料採用最終一致性，以維持系統反應速度與可用性。,Conflict
107,訂餐外送系統,系統應蒐集詳細的使用者瀏覽、下單與偏好資料，用於行銷分析。,系統應只蒐集完成訂單所必需的最少個人資料。,Conflict
108,訂餐外送系統,系統應允許平台營運方使用可識別的顧客資料進行個人化促銷。,系統應在未取得明確同意前避免使用可識別的顧客資料進行行銷。,Conflict
109,訂餐外送系統,餐廳接單介面應只顯示最少資訊，以便快速接受或拒絕訂單。,餐廳接單介面應在接單前完整顯示餐點選項、顧客備註與訂單細節。,Conflict
110,訂餐外送系統,系統應允許顧客依地點、類別、評分、外送時間與價格搜尋餐廳。,系統應允許餐廳新增、修改、刪除餐點項目並設定價格與庫存狀態。,Neutral
111,訂餐外送系統,系統應允許顧客將多項餐點加入購物車並調整數量或移除項目。,系統應允許餐廳查看每日、每週或自訂期間的營收統計與訂單數據報表。,Neutral
112,訂餐外送系統,系統應支援信用卡、行動支付、電子錢包或貨到付款等付款方式。,系統應在訂單狀態變更時透過應用程式推播、簡訊或電子郵件通知相關使用者。,Neutral
113,訂餐外送系統,系統應讓顧客即時查看訂單狀態與外送員位置。,系統應讓外送員使用內建或整合地圖導航至取餐與送達地點。,Neutral
114,訂餐外送系統,系統應允許顧客查詢歷史訂單、再次下單或在可取消時間內取消訂單。,系統應允許顧客在結帳時輸入優惠代碼或選擇折扣券。,Neutral
115,訂餐外送系統,系統應提供客服介面查詢訂單明細、退款處理流程及追蹤歷史。,系統應提供角色基礎存取控制以管理顧客、餐廳、外送員、客服與管理者權限。,Neutral
116,訂餐外送系統,系統應允許顧客對餐廳與外送員進行星級與文字評價。,系統應允許外送員查看每日收益、工時、評價與接單數據報表。,Neutral
117,訂餐外送系統,系統應記錄訂單歷史、錯誤日誌與系統事件。,系統應提供稽核日誌記錄退款、帳號修改與權限變更等關鍵操作。,Neutral
118,訂餐外送系統,系統應在結帳時讓顧客填寫聯絡電話與地址以完成配送。,系統應加密儲存用戶個資與支付資訊。,Neutral
119,訂餐外送系統,系統應允許顧客在訂單問題發生後申請退款或補償。,系統應允許管理者審核退款請求並檢視交易紀錄與帳務報表。,Neutral
